{
  "project": "Native Slack Integration",
  "description": "Replace Nango-based Slack integration with native implementation using browser session tokens (xoxc- + d cookie). Matches iMessage/LinkedIn stealth pattern.",
  "linearIssueId": "PRM-41",
  "target_stack": [
    "packages/integrations/src/slack/",
    "apps/electron/src/main/auth/",
    "apps/electron/src/main/sync/",
    "packages/convex/convex/sync/slack.ts"
  ],
  "decisions": {
    "tokenStorage": "LOCAL ONLY - macOS Keychain via Electron safeStorage",
    "contactSync": "Conversation-based only - no bulk workspace member import",
    "architecture": "Electron is sync hub (same as iMessage/LinkedIn)"
  },
  "tasks": [
    {
      "id": "1.1",
      "phase": 1,
      "mode": "afk",
      "description": "Create Slack login webview - apps/electron/src/main/auth/slack-login.ts with Electron BrowserWindow for Slack login",
      "steps": [
        "Create apps/electron/src/main/auth/slack-login.ts",
        "Implement BrowserWindow that opens Slack workspace login",
        "Add detection for successful login via localStorage token",
        "Extract xoxc- token from localStorage.localConfig_v2",
        "Extract d cookie from browser session",
        "Run pnpm typecheck in apps/electron to verify"
      ],
      "passes": true
    },
    {
      "id": "1.2",
      "phase": 1,
      "mode": "afk",
      "description": "Implement local credential storage using Electron safeStorage API",
      "steps": [
        "Create apps/electron/src/main/auth/slack-credentials.ts",
        "Implement saveSlackCredentials() with encryption via safeStorage",
        "Implement getSlackCredentials() to retrieve and decrypt",
        "Implement clearSlackCredentials() to remove from storage",
        "Add SlackStoredCredentials interface",
        "Run pnpm typecheck in apps/electron to verify"
      ],
      "passes": true,
      "dependencies": [
        "1.1"
      ]
    },
    {
      "id": "1.3",
      "phase": 1,
      "mode": "afk",
      "description": "Add Slack connection status to Convex integrations table (metadata only, no tokens)",
      "steps": [
        "Update packages/convex/convex/integrations.ts with updateSlackStatus mutation",
        "Store teamId, teamName, userId, isConnected",
        "Ensure NO token or cookie is stored in cloud",
        "Run pnpm typecheck in packages/convex to verify"
      ],
      "passes": true
    },
    {
      "id": "2.1",
      "phase": 2,
      "mode": "afk",
      "description": "Create SlackClient in packages/integrations/src/slack/",
      "steps": [
        "Create packages/integrations/src/slack/types.ts with Slack API types",
        "Create packages/integrations/src/slack/constants.ts with API URLs",
        "Create packages/integrations/src/slack/request.ts with retry logic",
        "Create packages/integrations/src/slack/client.ts with SlackClient class",
        "Implement testAuth(), listConversations(), getHistory(), getReplies(), postMessage(), getUserInfo()",
        "Export from packages/integrations/src/index.ts",
        "Run pnpm typecheck in packages/integrations to verify"
      ],
      "passes": true,
      "dependencies": ["1.1"]
    },
    {
      "id": "2.2",
      "phase": 2,
      "mode": "afk",
      "description": "Add RTM WebSocket implementation to SlackClient",
      "steps": [
        "Add connectRTM() method to packages/integrations/src/slack/client.ts",
        "Implement WebSocket auto-reconnect logic",
        "Add event handlers for message, reaction, typing events",
        "Run pnpm typecheck in packages/integrations"
      ],
      "passes": true,
      "dependencies": ["2.1"]
    },
    {
      "id": "3.1",
      "phase": 3,
      "mode": "afk",
      "description": "Create SlackSyncManager matching LinkedInSyncManager pattern",
      "steps": [
        "Create apps/electron/src/main/sync/slack-sync.ts",
        "Implement start() that initiates sync with RTM connection",
        "Implement stop() for clean disconnect",
        "Implement runSync() to fetch conversations and messages",
        "Add progress callbacks matching LinkedInSyncProgress pattern",
        "Add auth error handling with re-login prompt",
        "Run pnpm typecheck in apps/electron"
      ],
      "passes": true,
      "dependencies": [
        "1.2",
        "2.1",
        "2.2"
      ]
    },
    {
      "id": "3.2",
      "phase": 3,
      "mode": "afk",
      "description": "Update Convex sync/slack.ts for conversation-based sync",
      "steps": [
        "Add syncSlackConversationsInternal to packages/convex/convex/sync/slack.ts",
        "Create contacts from DM participants during conversation sync",
        "Update lastMessageAt and unreadCount on conversations",
        "Use batch processing for efficiency",
        "Run pnpm typecheck in packages/convex"
      ],
      "passes": true,
      "dependencies": [
        "1.3"
      ]
    },
    {
      "id": "3.3",
      "phase": 3,
      "mode": "afk",
      "description": "Update message sync for isFromMe detection",
      "steps": [
        "Update syncSlackMessagesInternal to compare message sender vs stored userId",
        "Add contact enrichment via getUserInfo API call",
        "Implement email matching for existing contacts",
        "Run pnpm typecheck in packages/convex"
      ],
      "passes": true,
      "dependencies": [
        "3.2"
      ]
    },
    {
      "id": "4.1",
      "phase": 4,
      "mode": "afk",
      "description": "Add Slack to message queue processor",
      "steps": [
        "Update apps/electron/src/main/queue/message-queue-processor.ts",
        "Add case 'slack' handler using SlackClient.postMessage()",
        "Support thread replies via threadTs parameter",
        "Add error handling and retry logic",
        "Run pnpm typecheck in apps/electron"
      ],
      "passes": true,
      "dependencies": [
        "3.1"
      ]
    },
    {
      "id": "4.2",
      "phase": 4,
      "mode": "afk",
      "description": "Update web API send route to use Electron relay",
      "steps": [
        "Update apps/web/app/api/slack/send/route.ts",
        "Route messages to Convex messageQueue for Electron pickup",
        "Ensure status updates flow back to web",
        "Run pnpm typecheck in apps/web"
      ],
      "passes": true,
      "dependencies": [
        "4.1"
      ]
    },
    {
      "id": "5.1",
      "phase": 5,
      "mode": "hitl",
      "description": "Update settings page for Slack connection flow",
      "steps": [
        "Update apps/web/(app)/settings/integrations/page.tsx",
        "Add 'Connect Slack' button when not connected",
        "Trigger Electron webview login on click",
        "Show connected status with team name",
        "Add disconnect option that clears local credentials",
        "Run pnpm typecheck in apps/web"
      ],
      "passes": true,
      "dependencies": [
        "1.1",
        "1.2",
        "1.3"
      ]
    },
    {
      "id": "6.1",
      "phase": 6,
      "mode": "afk",
      "description": "Remove Nango Slack integration",
      "steps": [
        "Delete packages/integrations/src/nango/slack.ts",
        "Delete nango-integrations/slack/ directory",
        "Delete apps/web/app/api/nango/pull-slack/route.ts",
        "Delete apps/web/__tests__/api/pull-slack.test.ts",
        "Delete apps/web/SLACK_SETUP.md",
        "Update packages/integrations/src/nango/index.ts to remove Slack exports",
        "Verify no Nango Slack references remain",
        "Run pnpm typecheck && pnpm lint"
      ],
      "passes": true,
      "dependencies": [
        "4.2",
        "5.1"
      ]
    },
    {
      "id": "7.1",
      "phase": 7,
      "mode": "afk",
      "description": "Write unit tests for SlackClient",
      "steps": [
        "Create packages/integrations/src/slack/__tests__/client.test.ts",
        "Add tests for auth validation",
        "Add tests for API methods with mocked responses",
        "Add tests for error handling",
        "Add tests for RTM connection logic",
        "Run pnpm test in packages/integrations"
      ],
      "passes": true,
      "dependencies": [
        "2.1",
        "2.2"
      ]
    },
    {
      "id": "7.2",
      "phase": 7,
      "mode": "hitl",
      "description": "Integration testing - manual end-to-end flow",
      "steps": [
        "Test login flow in Electron",
        "Verify messages sync correctly",
        "Test sending messages",
        "Confirm contacts created from conversations only",
        "Test RTM real-time updates",
        "Document any issues found"
      ],
      "passes": false,
      "dependencies": [
        "6.1",
        "7.1"
      ]
    }
  ]
}