{
  "project": "Linear PRD CLI Integration",
  "description": "CLI tool to convert Linear issues to executable PRDs with task tracking and bidirectional sync",
  "linearIssueId": "PRM-38",
  "target_stack": [
    "typescript",
    "commander",
    "linear-mcp",
    "claude-code-cli"
  ],
  "decisions": {
    "cli_framework": "Commander.js for CLI parsing",
    "prd_format": "JSON with schema validation",
    "execution_engine": "Claude Code CLI via child_process",
    "state_persistence": "PRD JSON file updated in-place"
  },
  "tasks": [
    {
      "id": "1.1",
      "phase": 1,
      "mode": "hitl",
      "category": "architectural",
      "description": "Define PRD JSON schema and Linear issue template",
      "steps": [
        "Create scripts/templates/ directory structure",
        "Define prd-schema.json with: project, linearIssueId, tasks[], decisions{}, target_stack[]",
        "Task schema: id, phase, mode (hitl|afk), category, description, steps[], passes, error?",
        "Create linear-issue.md template with sections: Overview, Acceptance Criteria, Technical Notes, Sub-tasks",
        "Add JSON schema $id and validation keywords"
      ],
      "passes": true
    },
    {
      "id": "1.2",
      "phase": 1,
      "mode": "afk",
      "category": "functional",
      "description": "Set up CLI project structure with Commander",
      "steps": [
        "Initialize scripts/package.json with typescript, commander, zod dependencies",
        "Configure tsconfig.json for ESM output",
        "Create src/index.ts with commander program setup",
        "Add bin entry point in package.json",
        "Add prd command with subcommands: pull, run, sync, status"
      ],
      "passes": true
    },
    {
      "id": "1.3",
      "phase": 1,
      "mode": "afk",
      "category": "functional",
      "description": "Create shared types and utilities",
      "steps": [
        "Create src/types.ts with PRD, Task, LinearIssue interfaces",
        "Create src/utils/file.ts for PRD file read/write operations",
        "Create src/utils/linear.ts stub for MCP interactions",
        "Add Zod schemas for runtime validation of PRD files",
        "Export all types from src/index.ts"
      ],
      "passes": true
    },
    {
      "id": "2.1",
      "phase": 2,
      "mode": "hitl",
      "category": "integration",
      "description": "Implement Linear MCP client for fetching issues",
      "steps": [
        "Create src/linear/client.ts using mcp__linear__get_issue",
        "Parse issue fields: title, description, labels, assignee, state",
        "Extract acceptance criteria from description (checkbox pattern)",
        "Fetch sub-issues using mcp__linear__list_issues with parentId filter",
        "Return structured LinearIssue object with sub-tasks"
      ],
      "passes": true
    },
    {
      "id": "2.2",
      "phase": 2,
      "mode": "hitl",
      "category": "functional",
      "description": "Implement PRD generation from Linear issue",
      "steps": [
        "Create src/commands/pull.ts command handler",
        "Parse acceptance criteria into task candidates",
        "Group tasks into phases based on keywords (setup, implement, test, etc.)",
        "Assign mode (hitl/afk) based on task complexity heuristics",
        "Generate task steps from acceptance criteria text",
        "Write PRD JSON to scripts/prds/{issue-id}-prd.json",
        "Output success message with file path"
      ],
      "passes": true
    },
    {
      "id": "2.3",
      "phase": 2,
      "mode": "hitl",
      "category": "functional",
      "description": "Implement task execution engine",
      "steps": [
        "Create src/commands/run.ts command handler",
        "Load and validate PRD file from path argument",
        "Filter tasks by passes=false for pending work",
        "For each task: spawn claude-code CLI with task prompt",
        "Capture stdout/stderr and exit code",
        "Update task.passes and task.error in PRD file after each task",
        "Handle Ctrl+C gracefully, saving progress"
      ],
      "passes": true
    },
    {
      "id": "2.4",
      "phase": 2,
      "mode": "afk",
      "category": "functional",
      "description": "Add --interactive flag for step-by-step execution",
      "steps": [
        "Add --interactive / -i flag to run command",
        "Before each task: display task description and steps",
        "Prompt user: [r]un / [s]kip / [q]uit",
        "On 'skip': mark task skipped, continue to next",
        "On 'quit': save progress and exit",
        "Use readline for interactive prompts"
      ],
      "passes": true
    },
    {
      "id": "2.5",
      "phase": 2,
      "mode": "afk",
      "category": "functional",
      "description": "Implement HITL vs AFK mode handling",
      "steps": [
        "Add --mode flag to run command (hitl|afk|auto)",
        "In auto mode: respect task.mode setting",
        "In hitl mode: always prompt for confirmation",
        "In afk mode: skip confirmation, run all tasks",
        "Pass appropriate flags to claude-code CLI based on mode"
      ],
      "passes": true
    },
    {
      "id": "3.1",
      "phase": 3,
      "mode": "hitl",
      "category": "integration",
      "description": "Implement Linear sync for progress updates",
      "steps": [
        "Create src/commands/sync.ts command handler",
        "Calculate completion percentage from tasks",
        "Update Linear issue status via mcp__linear__update_issue",
        "Map completion to states: 0%=In Progress, 100%=Done",
        "Create/update Linear Document with PRD content via mcp__linear__create_document or mcp__linear__update_document",
        "Add completion summary comment via mcp__linear__create_comment"
      ],
      "passes": true
    },
    {
      "id": "3.2",
      "phase": 3,
      "mode": "afk",
      "category": "functional",
      "description": "Implement status command",
      "steps": [
        "Create src/commands/status.ts command handler",
        "Load PRD file and calculate stats",
        "Display: completion %, pending count, in-progress, completed",
        "List blockers (tasks with errors)",
        "Format output with colors using chalk",
        "Show task breakdown by phase"
      ],
      "passes": true
    },
    {
      "id": "4.1",
      "phase": 4,
      "mode": "afk",
      "category": "polish",
      "description": "Add error handling and retry logic",
      "steps": [
        "Wrap all MCP calls in try/catch with meaningful errors",
        "Add --retry flag to run command",
        "On retry: re-run tasks where passes=false and error exists",
        "Add exponential backoff for MCP rate limits",
        "Validate PRD file exists before operations"
      ],
      "passes": true
    },
    {
      "id": "4.2",
      "phase": 4,
      "mode": "afk",
      "category": "polish",
      "description": "Add logging and verbose output",
      "steps": [
        "Add --verbose / -v flag to all commands",
        "Log MCP requests/responses in verbose mode",
        "Add timestamps to execution logs",
        "Create src/utils/logger.ts with log levels",
        "Color-code output: green=success, red=error, yellow=warning"
      ],
      "passes": true
    },
    {
      "id": "5.1",
      "phase": 5,
      "mode": "afk",
      "category": "testing",
      "description": "Add unit tests for core utilities",
      "steps": [
        "Set up vitest in scripts/package.json",
        "Test PRD file read/write operations",
        "Test task filtering and status calculation",
        "Test acceptance criteria parsing",
        "Test phase grouping logic"
      ],
      "passes": true
    },
    {
      "id": "5.2",
      "phase": 5,
      "mode": "hitl",
      "category": "testing",
      "description": "Manual integration test with real Linear issue",
      "steps": [
        "Create test Linear issue with acceptance criteria",
        "Run prd pull on test issue",
        "Verify PRD JSON structure and content",
        "Run prd run --interactive on generated PRD",
        "Run prd sync and verify Linear updates",
        "Run prd status and verify output"
      ],
      "passes": true
    },
    {
      "id": "5.3",
      "phase": 5,
      "mode": "afk",
      "category": "deployment",
      "description": "Write documentation and finalize",
      "steps": [
        "Create scripts/README.md with usage examples",
        "Document all CLI commands and flags",
        "Add examples for pull, run, sync, status",
        "Update root CLAUDE.md with PRD CLI section",
        "Verify pnpm prd commands work from scripts/"
      ],
      "passes": true
    }
  ]
}